Reading List ID,Google Books ID,Apple Books ID,ISBN-13,Title,Subtitle,Authors,Page Count,Publication Date,Publisher,Description,Subjects,Language Code,Started Reading,Paused,Finished Reading,Did Not Finish,Current Page,Current Percentage,Rating,Notes,Lists
DB25DEEB-F2A5-46CC-B919-9FF55232C4B2,lwU3EAAAQBAJ,,9781982159337,How to Be Perfect,The Correct Answer to Every Moral Question,"Schur, Michael",304,,Simon and Schuster,"From the creator of The Good Place and the cocreator of Parks and Recreation, a hilarious, thought-provoking guide to living an ethical life, drawing on 2,400 years of deep thinking from around the world.

Most people think of themselves as “good,” but it’s not always easy to determine what’s “good” or “bad”—especially in a world filled with complicated choices and pitfalls and booby traps and bad advice. Fortunately, many smart philosophers have been pondering this conundrum for millennia and they have guidance for us. With bright wit and deep insight, How to Be Perfect explains concepts like deontology, utilitarianism, existentialism, ubuntu, and more so we can sound cool at parties and become better people.

Schur starts off with easy ethical questions like “Should I punch my friend in the face for no reason?” (No.) and works his way up to the most complex moral issues we all face. Such as: Can I still enjoy great art if it was created by terrible people? How much money should I give to charity? Why bother being good at all when there are no consequences for being bad? And much more. By the time the book is done, we’ll know exactly how to act in every conceivable situation, so as to produce a verifiably maximal amount of moral good. We will be perfect, and all our friends will be jealous. OK, not quite. Instead, we’ll gain fresh, funny, inspiring wisdom on the toughest issues we face every day.",Adult; Celebrity & Popular Culture; Ethics & Moral Philosophy; Humor; Philosophy; Topic,en,2022-01-30,,2022-03-13,,,,3.0,Not as funny as I hoped—I’m starting to think “funny” books aren’t my thing—but seemed to be a devent overview of moral philosophy. ,
6FF37B16-5169-4B66-83CB-6228B44614AE,n09kDwAAQBAJ,,9781250313560,The Moment of Lift,How Empowering Women Changes the World,"Gates, Melinda",224,,Flatiron Books,"NEW YORK TIMES BESTSELLER

“In her book, Melinda tells the stories of the inspiring people she’s met through her work all over the world, digs into the data, and powerfully illustrates issues that need our attention—from child marriage to gender inequity in the workplace.” — President Barack Obama

“The Moment of Lift is an urgent call to courage. It changed how I think about myself, my family, my work, and what’s possible in the world. Melinda weaves together vulnerable, brave storytelling and compelling data to make this one of those rare books that you carry in your heart and mind long after the last page.”

— Brené Brown, Ph.D., author of the New York Times #1 bestseller Dare to Lead
 
“Melinda Gates has spent many years working with women around the world. This book is an urgent manifesto for an equal society where women are valued and recognized in all spheres of life. Most of all, it is a call for unity, inclusion and connection. We need this message more than ever.” — Malala Yousafzai

""Melinda Gates's book is a lesson in listening. A powerful, poignant, and ultimately humble call to arms."" — Tara Westover, author of the New York Times #1 bestseller Educated

 A debut from Melinda Gates, a timely and necessary call to action for women's empowerment.

“How can we summon a moment of lift for human beings – and especially for women? Because when you lift up women, you lift up humanity.”




For the last twenty years, Melinda Gates has been on a mission to find solutions for people with the most urgent needs, wherever they live. Throughout this journey, one thing has become increasingly clear to her: If you want to lift a society up, you need to stop keeping women down.

In this moving and compelling book, Melinda shares lessons she’s learned from the inspiring people she’s met during her work and travels around the world. As she writes in the introduction, “That is why I had to write this book—to share the stories of people who have given focus and urgency to my life. I want all of us to see ways we can lift women up where we live.”

Melinda’s unforgettable narrative is backed by startling data as she presents the issues that most need our attention—from child marriage to lack of access to contraceptives to gender inequity in the workplace. And, for the first time, she writes about her personal life and the road to equality in her own marriage. Throughout, she shows how there has never been more opportunity to change the world—and ourselves.

Writing with emotion, candor, and grace, she introduces us to remarkable women and shows the power of connecting with one another.

When we lift others up, they lift us up, too.",Biography & Autobiography; Human Rights; Political Science; Social Science; Women; Women's Studies,en,2019-12-12,,2019-12-15,,,,,,
582471A0-F55B-43EA-89F3-D33229D3FC54,nPF9n0SwstMC,,9780345539793,Red Rising,,"Brown, Pierce",400,,Random House Publishing Group,"NEW YORK TIMES BESTSELLER • Pierce Brown’s relentlessly entertaining debut channels the excitement of The Hunger Games by Suzanne Collins and Ender’s Game by Orson Scott Card. 

“Red Rising ascends above a crowded dys­topian field.”—USA Today

NAMED ONE OF THE BEST BOOKS OF THE YEAR BY ENTERTAINMENT WEEKLY, BUZZFEED, AND SHELF AWARENESS

“I live for the dream that my children will be born free,” she says. “That they will be what they like. That they will own the land their father gave them.”
“I live for you,” I say sadly.
Eo kisses my cheek. “Then you must live for more.”

Darrow is a Red, a member of the lowest caste in the color-coded society of the future. Like his fellow Reds, he works all day, believing that he and his people are making the surface of Mars livable for future generations. Yet he toils willingly, trusting that his blood and sweat will one day result in a better world for his children.

But Darrow and his kind have been betrayed. Soon he discovers that humanity reached the surface generations ago. Vast cities and lush wilds spread across the planet. Darrow—and Reds like him—are nothing more than slaves to a decadent ruling class.

Inspired by a longing for justice, and driven by the memory of lost love, Darrow sacrifices everything to infiltrate the legendary Institute, a proving ground for the dominant Gold caste, where the next generation of humanity’s overlords struggle for power.  He will be forced to compete for his life and the very future of civilization against the best and most brutal of Society’s ruling class. There, he will stop at nothing to bring down his enemies . . . even if it means he has to become one of them to do so.

Praise for Red Rising

“[A] spectacular adventure . . . one heart-pounding ride . . . Pierce Brown’s dizzyingly good debut novel evokes The Hunger Games, Lord of the Flies, and Ender’s Game. . . . [Red Rising] has everything it needs to become meteoric.”—Entertainment Weekly

“Ender, Katniss, and now Darrow.”—Scott Sigler

“Red Rising is a sophisticated vision. . . . Brown will find a devoted audience.”—Richmond Times-Dispatch

Don’t miss any of Pierce Brown’s Red Rising Saga:
RED RISING • GOLDEN SON • MORNING STAR • IRON GOLD • DARK AGE",Action & Adventure; Dystopian; Fiction; Science Fiction,en,2019-02-23,,2019-02-27,,,,,,
B078C381-1155-4CF6-83FB-6DF2DB1958EA,nV9EDwAAQBAJ,,9780525572435,Make Time,How to Focus on What Matters Every Day,"Knapp, Jake; Zeratsky, John",304,,Crown Publishing Group,"From the New York Times bestselling authors of Sprint comes a simple 4-step system for improving focus, finding greater joy in your work, and getting more out of every day.

""A charming manifesto—as well as an intrepid do-it-yourself guide to building smart habits that stick. If you want to achieve more (without going nuts), read this book.""—Charles Duhigg, bestselling author of The Power of Habit and Smarter Faster Better 

Nobody ever looked at an empty calendar and said, ""The best way to spend this time is by cramming it full of meetings!"" or got to work in the morning and thought, Today I'll spend hours on Facebook! Yet that's exactly what we do. Why?

In a world where information refreshes endlessly and the workday feels like a race to react to other people's priorities faster, frazzled and distracted has become our default position. But what if the exhaustion of constant busyness wasn't mandatory? What if you could step off the hamster wheel and start taking control of your time and attention? That's what this book is about.

As creators of Google Ventures' renowned ""design sprint,"" Jake and John have helped hundreds of teams solve important problems by changing how they work. Building on the success of these sprints and their experience designing ubiquitous tech products from Gmail to YouTube, they spent years experimenting with their own habits and routines, looking for ways to help people optimize their energy, focus, and time. Now they've packaged the most effective tactics into a four-step daily framework that anyone can use to systematically design their days. Make Time is not a one-size-fits-all formula. Instead, it offers a customizable menu of bite-size tips and strategies that can be tailored to individual habits and lifestyles.

 Make Time isn't about productivity, or checking off more to-dos. Nor does it propose unrealistic solutions like throwing out your smartphone or swearing off social media. Making time isn't about radically overhauling your lifestyle; it's about making small shifts in your environment to liberate yourself from constant busyness and distraction.

A must-read for anyone who has ever thought, If only there were more hours in the day..., Make Time will help you stop passively reacting to the demands of the modern world and start intentionally making time for the things that matter.",Business & Economics; Decision-Making & Problem Solving; Personal Growth; Self-Help; Success; Time Management,en,2019-12-16,,2019-12-18,,,,,,
EA1EACA6-16A7-46CC-8FE0-6FB9164DD516,ovNFDwAAQBAJ,,9781788296717,Full-Stack Vue.js 2 and Laravel 5,"Bring the frontend and backend together with Vue, Vuex, and Laravel","Gore, Anthony",376,,Packt Publishing Ltd,"Learn to build professional full-stack web apps with Vue.js and Laravel

Key Features End-to-end guide on full-stack development with Vue.js 2 and Laravel 5  Developing modern user interfaces with a reusable component-based architecture  Use Webpack to improve applications performance and development workflow  Explore the features of Vuex to build applications that are powerful, consistent, and maintainable Book Description

Vue is a JavaScript framework that can be used for anything from simple data display to sophisticated front-end applications and Laravel is a PHP framework used for developing fast and secure web-sites. This book gives you practical knowledge of building modern full-stack web apps from scratch using Vue with a Laravel back end.

In this book, you will build a room-booking website named ""Vuebnb"". This project will show you the core features of Vue, Laravel and other state-of-the-art web development tools and techniques.

The book begins with a thorough introduction to Vue.js and its core concepts like data binding, directives and computed properties, with each concept being explained first, then put into practice in the case-study project.

You will then use Laravel to set up a web service and integrate the front end into a full-stack app. You will be shown a best-practice development workflow using tools like Webpack and Laravel Mix.

With the basics covered, you will learn how sophisticated UI features can be added using ES+ syntax and a component-based architecture. You will use Vue Router to make the app multi-page and Vuex to manage application state.

Finally, you will learn how to use Laravel Passport for authenticated AJAX requests between Vue and the API, completing the full-stack architecture. Vuebnb will then be prepared for production and deployed to a free Heroku cloud server.

What you will learn Core features of Vue.js to create sophisticated user interfaces  Build a secure backend API with Laravel  Learn a state-of-the-art web development workflow with Webpack  Full-stack app design principles and best practices  Learn to deploy a full-stack app to a cloud server and CDN  Managing complex application state with Vuex  Securing a web service with Laravel Passport  Who this book is for

This book targets developers who are new to Vue.js, Laravel, or both, and are seeking a practical, best-practice approach to development with these technologies.

They must have some knowledge of HTML, CSS and Javascript.",Computers; Design; JavaScript; Programming Languages; Web; Web Programming,en,2018-06-01,,2018-06-08,,,,,,
2E0E5B4E-AB0D-427A-878F-B93E0170D352,pKe-ngEACAAJ,,9780763660208,The Tail of Emily Windsnap,,"Kessler, Liz",208,,Candlewick Press,"A young girl learns she’s half mermaid and plunges into a scheme to reunite with her father in this entrancing, satisfying tale that beckons readers far below the waves.

For as long as she can remember, twelve-year-old Emily Windsnap has lived on a boat. And, oddly enough, for just as long, her mother has seemed anxious to keep Emily away from the water. But when Mom finally agrees to let her take swimming lessons, Emily makes a startling discovery — about her own identity, the mysterious father she’s never met, and the thrilling possibilities and perils shimmering deep below the water’s surface. With a sure sense of suspense and richly imaginative details, first-time author Liz Kessler lures us into a glorious undersea world where mermaids study shipwrecks at school and Neptune rules with an iron trident — an enchanting fantasy about family secrets, loyal friendship, and the convention-defying power of love.


From the Hardcover edition.",Bullying; Family; Fantasy & Magic; Friendship; Juvenile Fiction; Social Issues,en,2022-03-27,,2022-03-27,,,,,Lily like this book and wanted me to read it,
584D2D6A-4814-4241-BC1D-D356B83FB89F,pShfCgAAQBAJ,,9780765378552,Shadows of Self,,"Sanderson, Brandon",383,,Macmillan,"From #1 New York Times bestselling author Brandon Sanderson, the Mistborn series is a heist story of political intrigue and magical, martial-arts action.

Three hundred years after the events of the Mistborn trilogy, Scadrial is now on the verge of modernity, with railroads to supplement the canals, electric lighting in the streets and the homes of the wealthy, and the first steel-framed skyscrapers racing for the clouds.

When family obligations forced Waxillium Ladrian to forsake the frontier lands and return to the metropolis of his birth to take his place as head of a noble House, he little imagined that the crime-fighting skills acquired during twenty years in the dusty plains would be just as applicable in the big city. He soon learned that there too, just being a talented Twinborn — one who can use both Allomancy and Feruchemy, the dominant magical modes on Scadrial — would not suffice.

This bustling, optimistic, but still shaky society will now face its first test by terrorism and assassination, crimes intended to stir up labor strife and religious conflict. Wax, his eccentric sidekick Wayne, and brilliant, beautiful young Marasi, now officially part of the constabulary, must unravel the conspiracy before civil strife can stop Scadrial’s progress in its tracks.

Other Tor books by Brandon Sanderson

The Cosmere

The Stormlight Archive
The Way of Kings
Words of Radiance
Edgedancer (Novella)
Oathbringer 

The Mistborn trilogy
Mistborn: The Final Empire
The Well of Ascension
The Hero of Ages

Mistborn: The Wax and Wayne series
Alloy of Law
Shadows of Self
Bands of Mourning

Collection
Arcanum Unbounded

Other Cosmere novels
Elantris
Warbreaker

The Alcatraz vs. the Evil Librarians series
Alcatraz vs. the Evil Librarians
The Scrivener's Bones
The Knights of Crystallia
The Shattered Lens
The Dark Talent

The Rithmatist series
The Rithmatist

Other books by Brandon Sanderson

The Reckoners
Steelheart
Firefight
Calamity",Action & Adventure; Epic; Fantasy; Fiction,en,2021-09-20,,2021-10-18,,,,,,
FFEB9ECF-ECC2-46F5-8974-65C642381996,pWAYDQAAQBAJ,,9781101984659,Good Clean Fun,Misadventures in Sawdust at Offerman Woodshop,"Offerman, Nick",344,,Penguin,"After two New York Times bestsellers, Nick Offerman--woodworker, actor, comedian, and co-host of NBC's crafting competition series Making It--returns with the subject for which he's known best--his incredible real-life woodshop.

Nestled among the glitz and glitter of Tinseltown is a testament to American elbow grease and an honest-to-god hard day's work: Offerman Woodshop. Captained by hirsute woodworker, actor, comedian, and writer Nick Offerman, the shop produces not only fine handcrafted furniture, but also fun stuff--kazoos, baseball bats, ukuleles, mustache combs, even cedar-strip canoes.

Now Nick and his ragtag crew of champions want to share their experience of working at the Woodshop, tell you all about their passion for the discipline of woodworking, and teach you how to make a handful of their most popular projects along the way. This book takes readers behind the scenes of the woodshop, both inspiring and teaching them to make their own projects and besotting them with the infectious spirit behind the shop and its complement of dusty wood-elves.

In these pages you will find a variety of projects for every skill level, with personal, easy-to-follow instructions by the OWS woodworkers themselves; and, what's more, this tutelage is augmented by mouth-watering color photos (Nick calls it ""wood porn""). You will also find writings by Nick, offering recipes for both comestibles and mirth, humorous essays, odes to his own woodworking heroes, insights into the ethos of woodworking in modern America, and other assorted tomfoolery.

Whether you've been working in your own shop for years, or if holding this stack of compressed wood pulp is as close as you've ever come to milling lumber, or even if you just love Nick Offerman's brand of bucolic yet worldly wisdom, you'll find Good Clean Fun full of useful, illuminating, and entertaining information.",CRAFTS & HOBBIES; Form; HOUSE & HOME; HUMOR; Pictorial; Woodwork; Woodworking,en,2018-04-08,,2018-04-18,,,,,,
077231AC-E9FB-4BD6-9A44-AAE21E671B66,qNNmDwAAQBAJ,,9781982112387,Principles,,"Dalio, Ray",592,,Simon and Schuster,"#1 New York Times Bestseller

“Significant...The book is both instructive and surprisingly moving.” —The New York Times

Ray Dalio, one of the world’s most successful investors and entrepreneurs, shares the unconventional principles that he’s developed, refined, and used over the past forty years to create unique results in both life and business—and which any person or organization can adopt to help achieve their goals.

In 1975, Ray Dalio founded an investment firm, Bridgewater Associates, out of his two-bedroom apartment in New York City. Forty years later, Bridgewater has made more money for its clients than any other hedge fund in history and grown into the fifth most important private company in the United States, according to Fortune magazine. Dalio himself has been named to Time magazine’s list of the 100 most influential people in the world. Along the way, Dalio discovered a set of unique principles that have led to Bridgewater’s exceptionally effective culture, which he describes as “an idea meritocracy that strives to achieve meaningful work and meaningful relationships through radical transparency.” It is these principles, and not anything special about Dalio—who grew up an ordinary kid in a middle-class Long Island neighborhood—that he believes are the reason behind his success.

In Principles, Dalio shares what he’s learned over the course of his remarkable career. He argues that life, management, economics, and investing can all be systemized into rules and understood like machines. The book’s hundreds of practical lessons, which are built around his cornerstones of “radical truth” and “radical transparency,” include Dalio laying out the most effective ways for individuals and organizations to make decisions, approach challenges, and build strong teams. He also describes the innovative tools the firm uses to bring an idea meritocracy to life, such as creating “baseball cards” for all employees that distill their strengths and weaknesses, and employing computerized decision-making systems to make believability-weighted decisions. While the book brims with novel ideas for organizations and institutions, Principles also offers a clear, straightforward approach to decision-making that Dalio believes anyone can apply, no matter what they’re seeking to achieve.

Here, from a man who has been called both “the Steve Jobs of investing” and “the philosopher king of the financial universe” (CIO magazine), is a rare opportunity to gain proven advice unlike anything you’ll find in the conventional business press.",Business & Economics; Investing; Leadership; Personal Finance,en,2018-06-09,,2018-06-30,,,,,,
5792CA9B-EEB0-49D8-A904-91897F5A7512,qmMqDAAAQBAJ,,9780143109259,Modern Romance,,"Ansari, Aziz; Klinenberg, Eric",277,,Penguin,"Now a New York Times Bestseller

A hilarious, thoughtful, and in-depth exploration of the pleasures and perils of modern romance from one of this generation's sharpest comedic voices

At some point, every one of us embarks on a journey to find love. We meet people, date, get into and out of relationships, all with the hope of finding someone with whom we share a deep connection. This seems standard now, but it's wildly different from what people did even just decades ago. Single people today have more romantic options than at any point in human history. With technology, our abilities to connect with and sort through these options are staggering. So why are so many people frustrated?

Some of our problems are unique to our time. ""Why did this guy just text me an emoji of a pizza?"" ""Should I go out with this girl even though she listed Combos as one of her favorite snack foods? Combos?!"" ""My girlfriend just got a message from some dude named Nathan. Who's Nathan? Did he just send her a photo of his penis? Should I check just to be sure?""

But the transformation of our romantic lives can't be explained by technology alone. In a short period of time, the whole culture of finding love has changed dramatically. A few decades ago, people would find a decent person who lived in their neighborhood. Their families would meet and, after deciding neither party seemed like a murderer, they would get married and soon have a kid, all by the time they were twenty-four. Today, people marry later than ever and spend years of their lives on a quest to find the perfect person, a soul mate.

For years, Aziz Ansari has been aiming his comic insight at modern romance, but for Modern Romance, the book, he decided he needed to take things to another level. He teamed up with NYU sociologist Eric Klinenberg and designed a massive research project, including hundreds of interviews and focus groups conducted everywhere from Tokyo to Buenos Aires to Wichita. They analyzed behavioral data and surveys and created their own online research forum on Reddit, which drew thousands of messages. They enlisted the world's leading social scientists, including Andrew Cherlin, Eli Finkel, Helen Fisher, Sheena Iyengar, Barry Schwartz, Sherry Turkle, and Robb Willer. The result is unlike any social science or humor book we've seen before.

In Modern Romance, Ansari combines his irreverent humor with cutting-edge social science to give us an unforgettable tour of our new romantic world.


From the Hardcover edition.",,en,2019-10-25,,2019-10-27,,,,,,
